Sentence,Entity
"Sie wollen, dass die Grünen Wähler so gefrustet sind, weil es so wenig vorangeht, dass sie die Grünen bei den nächsten Landtags waren, vor allem bei den nächsten Bundestagswahl nicht mehr wählen.",Grüne
Warum hat die FDP denn was davon?,FDP
Wenn die Wähler innen der Grünen frustriert sind und vielleicht idealerweise aus sich der FDP die Grünen nicht mehr wählen?,FDP
Wenn die Wähler innen der Grünen frustriert sind und vielleicht idealerweise aus sich der FDP die Grünen nicht mehr wählen?,Grüne
Und das ist so ein bisschen die Idee der FDP-Spitze.,FDP
"Ob das dazu führt, dass sie sagen, dann wählen wir keine Grünen mehr oder ob die nicht dann doch sagen, okay, wir müssen die Grünen wählen und wir müssen alles daran setzen, damit die so viel stimmen, haben damit die FDP in der nächsten Regierung keine Rolle mehr spielt.",FDP
"Ob das dazu führt, dass sie sagen, dann wählen wir keine Grünen mehr oder ob die nicht dann doch sagen, okay, wir müssen die Grünen wählen und wir müssen alles daran setzen, damit die so viel stimmen, haben damit die FDP in der nächsten Regierung keine Rolle mehr spielt.",Grüne
"Und man könnte natürlich sagen, auch selbst die frustrierten aus Lützerat und so werden ja wohl hoffentlich trotzdem Grünen wählen, weil alle anderen Parteien quasi aus der ökologischen Perspektive noch schlimmer sind.",Grüne
"Ja, was ist passiert, diese radikale Klimaliste ist nicht in den Landtag gekommen, sie ist nämlich an der 5% Hürde gescheitert, aber wer auch nicht in den Landtag gekommen ist, sind die Grünen.",Grüne
"Also man muss schon sehr deutlich sagen, dass beispielsweise Saarland zeigt, dass diese Demobilisierung und Frustration der Grünenbasis eine extrem gefährliche Strategie ist aus sich der Grund.",Grüne
"Es ist durchaus möglich, dass sich weitere radikal grüne Basisbewegungen gründen und bei den nächsten Bundestagswahl den Grünen die entscheidenden 3% Punkte klauen.",Grüne
"Und ein bisschen Kritik kam an der letzten Ausgabe, weil wir den Vorschlag zu einer Wahlrechtsreform etwas unterbelichtet haben, der von der Union eingebracht wurde und eingebracht wird.",Union
"Weil es sich nicht, aber das ist so das, was sie es gezielt haben, was sie gerne machen würden statt, dass Plan es den die Ampel vorgelegt hat.",Ampel
Deswegen schlägt die Union jetzt einfach vor.,Union
Nur die Unionsparteien würden deutlich Mandate hinzugewinnen.,Union
"Ich fand, das war ja gerade der Scham auch an dem Ampelvorschlag, dass er an der Art wieder mehrheiten generiert werden.",Ampel
"Genau, dass das bei allen Streit um diesen Vorschlag und die Direktmandate aber die Art und Weise, wie die Mehrheit im Bundestag hergestellt wird, daran endet der Ampelvorschlag, würde der Ampelvorschlag eben nichts ändern.",Ampel
"Und ich würde sagen, deshalb ist dieser Unionvorschlag auch wirklich kein ernsthafter Beitrag zur Diskussion.",Union
"In Diskutabel würde dazu führen, dass die Union fast immer eine Mehrheit hätte im Deutschen Bundestag.",Union
"Wenn man ganz ehrlich das kann, um wirklich außerhalb der Union niemand wollen.",Union
"Es wäre einfach quasi optisch schon schön, wenn die Union jetzt mit einem Bord wäre.",Union
"Aber dazu muss ich natürlich, würde ich sagen, in erster Linie die Union bewegen.",Union
"Und ein Grabem-Wahlrecht, wo völlig unsweiflerft eigentlich ist, dass allein die Union gewinnen würde, um massiv massiv gewinnen würde.",Union
"Aber ich finde auf der Ansatte, dass die Union schon punkt hat, nämlich ihr Anliegen, dass die Menschen, die eine Mehrheit in einem Wahlkreis mit der Erststimme errungen haben oder bald soll sie ja dann... Wahlkreis-Stimme haben, dass die dann auch tatsächlich in den Bundestag möglich einziehen sollen.",Union
Und diese total blockade der Union bei der Wahrheitsreform wird auch nicht halten.,Union
"Ich denke, die Union sollte daher um ihr Ziel möglich zu erreichen.",Union
Und das ist ja das Ziel der Union.,Union
"Aber ich bin total gespannt, wann die Union eigentlich merkt, dass das mit dem Grabemahlrecht eine Schnapsidee ist und die Strategie ändert.",Union
Die zu dem eine ganze Menge an Unterstützung bei der Ampel finden dürfte.,Ampel
"Also für die FDP-Wender sexy, die Fraktion bleibt ein bisschen größer.",FDP
"Denn man hört schon sehr deutliches Grummeln auch aus der FDP-Fraktion, wo die Leute einfach schon so ein Reise nach Jerusalem spielen und sagen, ""Okay, 1, 2 drin, du bist raus.""",FDP
"Denn man hört schon sehr deutliches Grummeln auch aus der FDP-Fraktion, wo die Leute einfach schon so ein Reise nach Jerusalem spielen und sagen, ""Okay, 1, 2 drin, du bist raus.""",FDP-Fraktion
Und auch bei den Grünen und SPD-Licht ist es imprinzip ähnlich.,SPD
Und auch bei den Grünen und SPD-Licht ist es imprinzip ähnlich.,Grüne
"Also immer noch kleiner als heute, aber größer als bisher nach dem Ampelvorschlag.",Ampel
"Wir hatten ja berichtet, dass das größte Problem oder die größte Folge, die schwerwiegendste Folge wäre, dass wenn der Ampelvorschlag so durchkommt, dass die Folge wäre, dass weniger Menschen von den hinteren Plätzen der Listen der Parteien in den Bundesländern in den Bundestag einzien würden.",Ampel
"Wir haben dann noch mal so ein bisschen Nachricht geschieht und es hat nämlich ein Mitglied des Bundestages von der SPD geschrieben und gesagt, wir haben auch paritätische Listen.",SPD
"Also wir hatten gesagt, die Grünen haben das.",Grüne
"Und deswegen haben wir noch mal nachgefragt und der impolitische Sprecher der SPD-Bundestationssituation Sebastian Hartmann hat uns geschrieben, stimmt.",SPD
"Haben uns Leute gesagt, aber die Linksfraktionen, die im Pressestelle wir angemärbelt hatten, hat nicht reagiert.",Linksfraktion
"Bei der FDP gibt es keine paritätischen Listen als Begründung nennt uns Johannes Mellheim, der stellvertretender Pressspeicher bei der FDP-Fraktion im Bundestag, der uns schreibt, wir Freie Demokraten wollen Menschen aller Geschlechter gleichermaßen ansprechen und bekennen uns klar zu einer stärkeren Frauenförderung in und außerhalb der Partei.",FDP
"Bei der FDP gibt es keine paritätischen Listen als Begründung nennt uns Johannes Mellheim, der stellvertretender Pressspeicher bei der FDP-Fraktion im Bundestag, der uns schreibt, wir Freie Demokraten wollen Menschen aller Geschlechter gleichermaßen ansprechen und bekennen uns klar zu einer stärkeren Frauenförderung in und außerhalb der Partei.",FDP-Fraktion
"Bei der FDP gibt es keine paritätischen Listen als Begründung nennt uns Johannes Mellheim, der stellvertretender Pressspeicher bei der FDP-Fraktion im Bundestag, der uns schreibt, wir Freie Demokraten wollen Menschen aller Geschlechter gleichermaßen ansprechen und bekennen uns klar zu einer stärkeren Frauenförderung in und außerhalb der Partei.",Freie Demokraten
Und die FDP.,FDP
Und die Union lehnt parität ebenfalls ab.,Union
"Da hat uns Julia Höller geschrieben, die stellvertretende Fraktionsvorsitzende der Grünen im Landtag in Nordrhein-Westfalen-Sprecherin für Innenpolitik.",Grüne
"Genau genommen ist es so, dass die vorherige Koalition abgeschafft hat, also die Koalition aus Union und FDP hat das abgeschafft.",FDP
"Genau genommen ist es so, dass die vorherige Koalition abgeschafft hat, also die Koalition aus Union und FDP hat das abgeschafft.",Union
"Aber die Grünen finden es zwar eigentlich wichtig, dass die Polizei gekennzeichnet wird.",Grüne
"Aber so wichtig dann irgendwie doch nicht, denn bei den Koalitionsverhandlungen mit der Union jetzt vor kurzem haben sie diese Forderungen nicht durchgesetzt.",Union
"Das heißt, ja, Union und FDP haben es abgeschafft, aber die Grünen haben es auch nicht wieder eingeführt.",FDP
"Das heißt, ja, Union und FDP haben es abgeschafft, aber die Grünen haben es auch nicht wieder eingeführt.",Union
"Das heißt, ja, Union und FDP haben es abgeschafft, aber die Grünen haben es auch nicht wieder eingeführt.",Grüne
"Ja, genau wie wir das eben im Wahlrecht gemacht haben, ja, es gibt Kritik der Union, die haben eigenen Vorschlacht, der ist quatsch, aber sie haben in gewisseren Sicht auch einen Punkt und die Ampel sollte in den Gegenkommen, indem das und das passiert.",Union
"Ja, genau wie wir das eben im Wahlrecht gemacht haben, ja, es gibt Kritik der Union, die haben eigenen Vorschlacht, der ist quatsch, aber sie haben in gewisseren Sicht auch einen Punkt und die Ampel sollte in den Gegenkommen, indem das und das passiert.",Ampel
Und unser erstes Thema sind die sogenannten Ampelverhandlungen.,Ampel
"Die legierte von SPD, Grünen und FDP.",FDP
"Die legierte von SPD, Grünen und FDP.",SPD
"Die legierte von SPD, Grünen und FDP.",Grüne
Ist die Ampelkoalition inzwischen wirklich in Reichweite?,Ampel
Ist die Ampelkoalition inzwischen wirklich in Reichweite?,Ampelkoalition
"Was wir aber schon noch mitteilen wollen, ist, dass es doch noch richtig dicke Bretter zu boren gibt, insbesondere die Grünen scheinen uns doch sehr besorgt zu sein, dass sich die Ampelkoalition wirklich auf einen 1,5 Grad-Kurs begeben.",Ampel
"Was wir aber schon noch mitteilen wollen, ist, dass es doch noch richtig dicke Bretter zu boren gibt, insbesondere die Grünen scheinen uns doch sehr besorgt zu sein, dass sich die Ampelkoalition wirklich auf einen 1,5 Grad-Kurs begeben.",Ampelkoalition
"Was wir aber schon noch mitteilen wollen, ist, dass es doch noch richtig dicke Bretter zu boren gibt, insbesondere die Grünen scheinen uns doch sehr besorgt zu sein, dass sich die Ampelkoalition wirklich auf einen 1,5 Grad-Kurs begeben.",Grüne
Und die scheint die FDP doch zumindest zum Teil retten zu wollen.,FDP
"Ja, das Problem dabei ist, dass natürlich für die Grünen insbesondere, aber auch für Teile der SPD völlig klar ist, die Ampel muss mindestens die sogenannten Paris-Ziele einhalten.",Ampel
"Ja, das Problem dabei ist, dass natürlich für die Grünen insbesondere, aber auch für Teile der SPD völlig klar ist, die Ampel muss mindestens die sogenannten Paris-Ziele einhalten.",SPD
"Ja, das Problem dabei ist, dass natürlich für die Grünen insbesondere, aber auch für Teile der SPD völlig klar ist, die Ampel muss mindestens die sogenannten Paris-Ziele einhalten.",Grüne
"Und nun ist es auf der anderen Seite aber so, dass die FDP ja auch Steuer nicht erhöhen will.",FDP
"Und da scheinen die Grünen auch Bauchschmerzen zu haben, dass die FDP vor allen Dingen auch auf synthetische Kraftstoffe setzt.",FDP
"Und da scheinen die Grünen auch Bauchschmerzen zu haben, dass die FDP vor allen Dingen auch auf synthetische Kraftstoffe setzt.",Grüne
"Also wenn da gibt es viel Kritik an der Haltung der FDP, die diese synthetischen Fules irgendwie auch als Klimapositiv fördern möchte.",FDP
Städt die Ampel auf rot.,Ampel
Für den Bayern hat auch schon offiziell die Corona-Wahn-Ampel auf rot geschaltet.,Ampel
"Anders, ein bisschen, sieht das schließlich Holstein, der Gesundheitsminister da von der FDP, Heiner Garg, hält 2G-Regeln nicht für sinnvoll.",FDP
Wir kommen jetzt zu den Reaktionen der werdenden Ampel-Koalition.,Ampel
"Ja, ich glaube, da herrscht auch bei der Ampel, auch bei FDP und Grünen unter SPD kein Zweifel.",FDP
"Ja, ich glaube, da herrscht auch bei der Ampel, auch bei FDP und Grünen unter SPD kein Zweifel.",Ampel
"Ja, ich glaube, da herrscht auch bei der Ampel, auch bei FDP und Grünen unter SPD kein Zweifel.",SPD
"Ja, ich glaube, da herrscht auch bei der Ampel, auch bei FDP und Grünen unter SPD kein Zweifel.",Grüne
"Aber die Liberalen und die Grünen sagen, wir wollen nicht mehr, dass diese schweren Eingriffe per Verordnung durchgeführt und eingeführt werden können.",Grüne
"Aber die Liberalen und die Grünen sagen, wir wollen nicht mehr, dass diese schweren Eingriffe per Verordnung durchgeführt und eingeführt werden können.",Liberale
"Wir haben gesagt, die Ampelkoalition hat sich auf einen Gesetzinwurf geeinigt, der am heutigen Donnerstag in den Bundestag gehen soll.",Ampel
"Wir haben gesagt, die Ampelkoalition hat sich auf einen Gesetzinwurf geeinigt, der am heutigen Donnerstag in den Bundestag gehen soll.",Ampelkoalition
"Finde, was haben denn SPD, Grünen und FDP da auf dem Zettel?",FDP
"Finde, was haben denn SPD, Grünen und FDP da auf dem Zettel?",SPD
"Finde, was haben denn SPD, Grünen und FDP da auf dem Zettel?",Grüne
"Hintergrund ist, dass die Ampelkoalitionäre davon ausgehen, dass zum Beispiel Schließungen von Lädenkultur und so weiter nicht mehr verhältnismäßig werden.",Ampel
"Hintergrund ist, dass die Ampelkoalitionäre davon ausgehen, dass zum Beispiel Schließungen von Lädenkultur und so weiter nicht mehr verhältnismäßig werden.",Ampelkoalition
"Denn das ist natürlich außerordentlich gefährlich, wenn Menschen sich im Internet ein Fake-Impf ausweist kaufen oder wenn irgendwelche Leute so tun, als seien sie Ärzte und falsche Bescheinigungen ausstellen, dass sie die Ampel offenbar auch so.",Ampel
"Das kann man nur begrüßen, dass die Ampel an dieser Stelle ganz schnell durchregiert.",Ampel
"Und die Ampel, die kommende, die wahrscheinlich bald kommende, hat sich auch ein relativ ambitionierten Zeitplan überlegt.",Ampel
"Eindeutig ist die Ampel verändertziemlich grundlegend, die gesetzlichen Grundlagen für die Corona-Bekämpfung.",Ampel
"Die Länder können viel weniger machen, aber da muss man dort nicht sagen, das ist jetzt nicht irgendwie passiert, sondern das ist ausdrücklich gewollt, insbesondere Grüne und FDP halten einen schneidenderen Maßnahmen nicht mehr für Verhältnis mäßig.",FDP
"Die Länder können viel weniger machen, aber da muss man dort nicht sagen, das ist jetzt nicht irgendwie passiert, sondern das ist ausdrücklich gewollt, insbesondere Grüne und FDP halten einen schneidenderen Maßnahmen nicht mehr für Verhältnis mäßig.",Grüne
"Denn das Interessante ist ja die Ampel reagiert fast so, als wäre die Pandemie schon vorbei.",Ampel
"Die häufig auch unter Druck stehen, sondern ich würde sagen, da muss eben das Unternehmen, in dem schlecht kontrolliert wird, pro Verstoß ein Busgelzahlen, der SPD-Gesundheitsexperte Carl Lauterbach geht noch weiter.",SPD
Ampel hat es jetzt sogar oder will es sogar komplett verbieten.,Ampel
"Wir blicken noch mal ganz kurz nach Glasgow, da geht ja diese Woche wahrscheinlich der Klimagipfel COP26. Zur Ende, wir haben uns auch das gilt so ein bisschen analog zu den Ampelverhandlungen gesagt, da schauen wir drauf, wenn die Ergebnisse vorliegen, wir wollten euch nur nicht verschweigen, das ist gestern Abend, also Mittwoch Abend doch eine, na, für viele doch überraschende Wortmeldung gegeben hat, und zwar von China und den USA, die ja beide für 45 Prozent ungefähr des Klimagas aus Stoßes Welt weit verantwortlich sind, also mit Abstand. -",Ampel
"Also das sind alles so Fragen, wie bei den Ampelverhandlungen auch.",Ampel
Und die Groko konnte sich auf den letzten Meter nicht mehr auf eine Nachfolgerin oder einen Nachfolger einigen.,Groko
Zurzeit laufen ja in Berlin die Koalitionsverhandlungen zur Gründung einer möglichen Ampelkoalition und eines der wohl umstrittensten Themen dabei.,Ampel
Zurzeit laufen ja in Berlin die Koalitionsverhandlungen zur Gründung einer möglichen Ampelkoalition und eines der wohl umstrittensten Themen dabei.,Ampelkoalition
"Da gibt es ja verschiedene Konzepte bei den Grünen bei der FDP, also sowas wie Klima-Gerät und Klima-Dividende, wo die Einnahmen mehr oder weniger alle genommen werden und an jeden Menschen bewirgert in Deutschland ausgeschüttet werden, von Kind bis zum Erwachsenen.",FDP
"Da gibt es ja verschiedene Konzepte bei den Grünen bei der FDP, also sowas wie Klima-Gerät und Klima-Dividende, wo die Einnahmen mehr oder weniger alle genommen werden und an jeden Menschen bewirgert in Deutschland ausgeschüttet werden, von Kind bis zum Erwachsenen.",Grüne
"Einerseits gibt es die großen und öffentlichen Bühnen, die sich zum Beispiel in diesem Jahr Olaf Scholz immer nur im Akkord Kamala Harris genommen haben, um ihre Reden zu halten zu aktuellen außenpolitischen Standpunkten.",Olaf Scholz
"Also sehr schon ein paar Monate her zuständig auf Seiten des Bundes ist das Bundesministerium für Bildung und Forschungministerin dort, Espatina, Stark, Watzinger von der FDP.",FDP
"Und deswegen kritisiert zum Beispiel auch Nicole Goulke, die stellvertretende Vorsitzte der Fraktion Die Linke im Bundestag gegen den Tagespiegel.",Fraktion Die Linke im Bundestag
"Und deswegen kritisiert zum Beispiel auch Nicole Goulke, die stellvertretende Vorsitzte der Fraktion Die Linke im Bundestag gegen den Tagespiegel.",Die Linke
"Und da wiederum sei das Argument gekommen, wir wollen jetzt auch nicht das Finanzministerium überholen mit so einer Bundeszahlplattform, denn das haben wir ja in der vergangenen Woche ausführlich diskutiert, das Bundesfinanzministerium sagt, wir brauchen über ein Jahr Zeit, bis wir unsere Direktzadungsplattform eingerichtet haben, dauert bis 2024. Wenn natürlich jetzt ein zweites FDP geführtes Haus, mal eben kurz vorgemacht, hätte wie es easy PC geht, dann hätte Herr Lindner so ein bisschen doof dargestanden.",FDP
"Und die Ampel und das Familienmist her, mal sich auf die Fahre geschrieben, wir wollen das A aufbessern und wir wollen es vor allen Dingen auf einer Plattform zentral zusammenfassen.",Ampel
"Die AfD, das unser letztes Thema für heute hat einen Sieg von den Bundesverfassungsgericht, Errungen, Inzachen, Finanzierung, Partei, Naherstiftung.",AfD
"Also da gibt sie Friedrich Ebert Stiftung von der SPD, da gibt sie Konrad-Adener Stiftung von der CDU, da gibt es die Heinrich Bölstiftung von den Grünen.",CDU
"Also da gibt sie Friedrich Ebert Stiftung von der SPD, da gibt sie Konrad-Adener Stiftung von der CDU, da gibt es die Heinrich Bölstiftung von den Grünen.",SPD
"Also da gibt sie Friedrich Ebert Stiftung von der SPD, da gibt sie Konrad-Adener Stiftung von der CDU, da gibt es die Heinrich Bölstiftung von den Grünen.",Grüne
"Die Friedrich Nahman Stiftung von der FDP, die Hans-Seidelsstiftung von der CSU und die Rosa-Luxenburg-Stiftung von den LINKEN.",FDP
"Die Friedrich Nahman Stiftung von der FDP, die Hans-Seidelsstiftung von der CSU und die Rosa-Luxenburg-Stiftung von den LINKEN.",CSU
"Und nun eben als New-Kamer in dieser Stiftung-Szener, vor Aufseiten der AfD, die DDS-Darius-Erasmus-Stiftung kurz DES.",AfD
"Das war für die AfD im Jahr 2019 noch nicht der Fall, um das ist jetzt hier gegenwürde Bundesverfassungsgericht und es werden nur die Dauerhaft ins Gewicht fallen den politischen Grundströmungen berücksichtigt.",AfD
"Alle Parteien am Stiftung bekommen Geld nur die AfD nahe, die DS bekommt nichts.",AfD
"Und dagegen hat die AfD nun vor der Bundesverfassungsgericht geklärt und, wie gesagt, jedenfalls mal einen Zwischenerfolg eingefahren, ob sie unter dem Strich auch wirklich mehr Kohlekriegen, zum Glück das Obtidee, das Kohlekrieg, das ist damit allerdings noch lange nicht raus.",AfD
"Ja, denn das Urteil sagt, dass der Alast des Haushaltsgesetzes 2019 mit der Förderung aller eben außer der AfD nahe Parteistiftung dieser Alast des Haushaltsgesetzes verletzte die AfD in ihrem Recht auf Schansengleichheit im politischen Wettbewerb.",AfD
"Also die AfD nahe, die Siderius Erasmusstiftung bekommt jetzt zwar nicht nachträglich Geld.",AfD
Das hatte die AfD beantragt.,AfD
"Aber wie gesagt, das bedeutet noch lange nicht, dass die Idee es in Zukunft auch gefördert wird, denn grundsätzlich mal kann dieses Gesetz natürlich auch dazu führen, dass die AfD nahe Stiftung weiterhin kein Geld bekommt.",AfD
"Da ist nur die Frage, wie kann man ein solches Kriterium formulieren, dass die AfD Stiftung nicht gefördert?",AfD
"Also, die AfD nahe DS fristen natürlich schon keine und versucht irgendwie so zu tun.",AfD
"Weiß ich noch, es war 2018, da hat irgendwie mehr fachsicht geweigert, der AfD oder der NPD weiß nicht mehr eine Stadthalte zu vermieten.",AfD
"Da geht es darum, dass man sich ausgehend die AfD wieder vor das Bundesverfassungsgericht ziehen kann.",AfD
In der letzten Woche haben wir Berichtet vom Besuch von Bundeskanzler Olaf Scholz in Moskoyer von seiner ausführlichen Pressekonferenz mit Putin.,Olaf Scholz
"Also insbesondere im Verhältnis zwischen Russland und der Ukraine ist das Verhalten der Wermacht und des dritten Reichs aus meiner Sicht überhaupt kein Argument, denn du hast es gesagt, die Wermacht hat ja eben die Sowierte-Union überfallen, nicht Russland.",Union
"Ja, das muss man sehen, also, bisschen was die Sowierten-Union ist ja angegriffen worden hat sich dann verteidigt.",Union
Nord Stream 2 ist gestoppt Olaf Scholz von der SPD-Stoppte.,SPD
Nord Stream 2 ist gestoppt Olaf Scholz von der SPD-Stoppte.,Olaf Scholz
"Und so hat das Kabinett der Koalitionsausschuss glaube ich, war es diese Woche der Ampel in Berlin ein sofortpaket beschlossen, mit dem Menschen hierzu lande entlastet werden sollen und vor diesen steigenden Energiekosten vor allem geschützt werden sollen und von ihnen mindestens zum Teil entlastet werden sollen.",Ampel
"Der nächste Schritt sind jetzt die parlamentarischen Beratungen, aber auf der anderen Seite scheint sich die Ampel hier ja doch relativ einig zu sein.",Ampel
"Ja, dann gibt es noch einen Corona-Zuschuss, also erwachsene Beziehende von Existenz, sichern den Leistungen, zum Beispiel H4, bekommen einmalig 100 Euro, ja Gold nach Handschlag, betrifft also vor allem Grundsicherung und arbeitslosen GL2, dann soll es eine Unterstützung für Kinder geben, ein sofortzuschlag für von Armut betroffene Kinder zum ersten Juli, 20 Euro im Monat bis zur Einführung der Kindergrundsicherung und vielleicht der Prominenteste beschluss dieser Woche der Mindestlohn, soll erhöht werden, das ist ja ein Wahlversprechen gewesen von Olaf Scholz und der SPD auf 12 Euro pro Stunde mindestens, fragt sich wann, ja, da heißt es zur Schulden der Erklärung der Ampel-Zitat, der Bundestag wird ein entsprechendes Gesetz zügig beschließen.",Ampel
"Ja, dann gibt es noch einen Corona-Zuschuss, also erwachsene Beziehende von Existenz, sichern den Leistungen, zum Beispiel H4, bekommen einmalig 100 Euro, ja Gold nach Handschlag, betrifft also vor allem Grundsicherung und arbeitslosen GL2, dann soll es eine Unterstützung für Kinder geben, ein sofortzuschlag für von Armut betroffene Kinder zum ersten Juli, 20 Euro im Monat bis zur Einführung der Kindergrundsicherung und vielleicht der Prominenteste beschluss dieser Woche der Mindestlohn, soll erhöht werden, das ist ja ein Wahlversprechen gewesen von Olaf Scholz und der SPD auf 12 Euro pro Stunde mindestens, fragt sich wann, ja, da heißt es zur Schulden der Erklärung der Ampel-Zitat, der Bundestag wird ein entsprechendes Gesetz zügig beschließen.",SPD
"Ja, dann gibt es noch einen Corona-Zuschuss, also erwachsene Beziehende von Existenz, sichern den Leistungen, zum Beispiel H4, bekommen einmalig 100 Euro, ja Gold nach Handschlag, betrifft also vor allem Grundsicherung und arbeitslosen GL2, dann soll es eine Unterstützung für Kinder geben, ein sofortzuschlag für von Armut betroffene Kinder zum ersten Juli, 20 Euro im Monat bis zur Einführung der Kindergrundsicherung und vielleicht der Prominenteste beschluss dieser Woche der Mindestlohn, soll erhöht werden, das ist ja ein Wahlversprechen gewesen von Olaf Scholz und der SPD auf 12 Euro pro Stunde mindestens, fragt sich wann, ja, da heißt es zur Schulden der Erklärung der Ampel-Zitat, der Bundestag wird ein entsprechendes Gesetz zügig beschließen.",Olaf Scholz
"Die Linke sagt, das ist zu wenig, davon profitieren zu wenig Menschen von diesem Heizkosten-Zuschuss, verbraucherschützer sagen, nicht nur zu wenig Menschen, sondern die kriegen auch noch zu wenig, also verbraucherschützer argumentieren.",Die Linke
"Was nicht kommt, ist ein Vorschlag der Union, Mehrwertsteuer, Rundersetzten auf Stromgras und Fernwärme.",Union
"Also macht die Ampel ja zum Teil jetzt auch so mit so einem Kinder sofort zu schlag und diesem Heizkosten-Zuschuster fließen ja direkt Euros an die Leute, die es dann vielleicht auch brauchen.",Ampel
"Die Ampel will das ja auch, die hat das in ihren Koalationsvertrag reingeschrieben, da steht drin, wollen sozialen Kompensationsmechanismus auf Deutsch Klimagelt.",Ampel
Christian Lindner von der FDP hat im Mittwoch jetzt auch nochmal gesagt im Bundestag Klimagelt soll noch in dieser Legislaturperiode kommen.,FDP
Christian Lindner von der FDP hat im Mittwoch jetzt auch nochmal gesagt im Bundestag Klimagelt soll noch in dieser Legislaturperiode kommen.,Christian Lindner
"Das ist eine Frage, die bisher unbeantwortet ist und die in der Koalition in der Ampel diskutiert wird.",Ampel
"Ja, das ist also der Vorwurf, den Immanuel Macron gegenbei den Bundeskanzler Olaf Scholz ins Besondere erhoben hat, gegenüber dessen Europa-Politik und Philipp.",Olaf Scholz
"Das gab es dann, das fand Olaf Scholz und die Deutschland natürlich überhaupt nicht toll, weil die natürlich mehr Quellen für Gas haben wollen.",Olaf Scholz
Es ist aber auf der anderen Seite für praktisch alle Partnerstaaten in der Europäischen Union durchaus ein Problem.,Union
"Ja, das ist ja das und das dieses viele zerschlagende Porzellan auf dem diplomatischen Paket das verweist, einfach auf die zentrale Schwäche von Olaf Scholz, Kommunikation.",Olaf Scholz
"Ja, es ist kindisch, Olaf Scholz jetzt in Paris ein paar Minuten warten zu lassen, nur um irgendwie deutlich zu machen.",Olaf Scholz
"Das finde ich einen richtigen politischen Fail, ein richtiges politisches Versagen von Olaf Scholz.",Olaf Scholz
"Und nach dem Angela Merkel dann hier amtier freiwillig abgegeben hat, hat Macron, sie wirklich in rühren, daweise verabschiedet ihr gedankt für ihren Einsatz in Europa, dass sie also quasi die europäische Union in schwierigen Zeiten zusammengehalten habe.",Union
